{
  "schemaVersion": "1.0",
  "meta": {
    "cliCommit": "496353c8aa0000000000000000000000000000ab",
    "cliVersion": "2.5.0-canary.3",
    "cliChannel": "local",
    "examplesCommit": "cab56d90000000000000000000000000000000ef",
    "generatedAt": "2026-05-25T03:14:00Z",
    "ciRun": {
      "url": "https://github.com/extension-js/extension.js/actions/runs/123456789",
      "workflow": "CI – Templates Nightly",
      "trigger": "schedule"
    }
  },
  "environment": {
    "os": "ubuntu",
    "osVersion": "22.04",
    "node": "20.x",
    "packageManager": "pnpm",
    "display": "xvfb",
    "browsers": [
      {"name": "chromium", "version": "131.0", "source": "playwright-cdn"},
      {"name": "firefox", "version": "133.0", "source": "playwright-cdn"}
    ]
  },
  "capabilityMatrix": [
    {"template": "content-react", "uiContexts": ["content"], "uiFramework": "react", "cssTech": "tailwind", "manifestVersion": 3},
    {"template": "sidebar-shadcn", "uiContexts": ["sidebar"], "uiFramework": "react", "cssTech": "tailwind", "manifestVersion": 3},
    {"template": "content-vue", "uiContexts": ["content"], "uiFramework": "vue", "cssTech": "css", "manifestVersion": 3}
  ],
  "results": [
    {
      "tier": "unit",
      "dimension": "unit.develop",
      "status": "pass",
      "source": {"kind": "vitest", "id": "ci:test:develop"},
      "metrics": {"tests": 690, "passed": 690, "failed": 0, "skipped": 2, "durationMs": 184000}
    },
    {
      "tier": "unit",
      "dimension": "unit.cli",
      "status": "pass",
      "source": {"kind": "vitest", "id": "ci:test:cli"},
      "metrics": {"tests": 280, "passed": 280, "failed": 0, "durationMs": 96000}
    },
    {
      "tier": "acceptance",
      "dimension": "acceptance.content",
      "status": "pass",
      "template": "content-react",
      "browser": "chromium",
      "surface": "content",
      "source": {"kind": "playwright-project", "id": "project=content"},
      "metrics": {"tests": 5, "passed": 5, "failed": 0, "retries": 0}
    },
    {
      "tier": "acceptance",
      "dimension": "acceptance.content",
      "status": "fail",
      "classification": "infra-flake",
      "template": "content-vue",
      "browser": "chromium",
      "surface": "content",
      "source": {"kind": "playwright-project", "id": "project=content"},
      "detail": "Shadow root never attached — content script not injected in headless. Known infra issue (TESTING_RESULTS.md); passes headed+xvfb.",
      "metrics": {"tests": 4, "passed": 1, "failed": 3, "retries": 2}
    },
    {
      "tier": "acceptance",
      "dimension": "reload.full",
      "status": "pass",
      "template": "action-locales",
      "browser": "firefox",
      "surface": "action",
      "source": {"kind": "verify-script", "id": "verify-full-extension-reload.mjs --browser=firefox"}
    },
    {
      "tier": "stability",
      "dimension": "reload.matrix",
      "status": "pass",
      "template": "action-locales",
      "browser": "chromium",
      "surface": "action",
      "source": {"kind": "reload-matrix", "id": "locales-single-edit-popup-closed"},
      "metrics": {"serviceWorkerRestarts": 1, "extensionPageNavigations": 0, "expected": "sw=1 nav=0"}
    },
    {
      "tier": "stability",
      "dimension": "reload.matrix",
      "status": "fail",
      "classification": "code-red",
      "template": "action",
      "browser": "chromium",
      "surface": "action",
      "source": {"kind": "reload-matrix", "id": "popup-html-edit-popup-open"},
      "detail": "Observed sw=2 nav=1; expected sw=0 nav=1. Extra SW restart = visible disruption regression.",
      "metrics": {"serviceWorkerRestarts": 2, "extensionPageNavigations": 1, "expected": "sw=0 nav=1"}
    },
    {
      "tier": "stability",
      "dimension": "install.modes",
      "status": "pass",
      "source": {"kind": "assert-script", "id": "assert-stable-install-modes.mjs"}
    },
    {
      "tier": "stability",
      "dimension": "build.oneRun",
      "status": "pass",
      "source": {"kind": "assert-script", "id": "assert-canary-one-run-builds.mjs"}
    },
    {
      "tier": "stability",
      "dimension": "create.devWorkflowAll",
      "status": "pass",
      "source": {"kind": "assert-script", "id": "assert-create-dev-workflow-all-templates.mjs"}
    },
    {
      "tier": "stability",
      "dimension": "dev.monorepo",
      "status": "pass",
      "template": "sidebar-monorepo-turbopack",
      "source": {"kind": "assert-script", "id": "assert-pnpm-monorepo-dev.mjs"}
    }
  ],
  "gatingPolicy": {
    "version": "gating-policy@1",
    "required": [
      "unit.develop",
      "unit.cli",
      "reload.matrix",
      "reload.full",
      "install.modes",
      "build.oneRun",
      "create.devWorkflowAll",
      "dev.monorepo"
    ],
    "advisory": ["acceptance.content"],
    "flakeHandling": "infra-flake-ignored"
  },
  "verdict": {
    "ready": false,
    "score": 0.91,
    "computedFrom": "gating-policy@1",
    "byDimension": {
      "unit.develop": "pass",
      "unit.cli": "pass",
      "acceptance.content": "fail",
      "reload.full": "pass",
      "reload.matrix": "fail",
      "install.modes": "pass",
      "build.oneRun": "pass",
      "create.devWorkflowAll": "pass",
      "dev.monorepo": "pass"
    },
    "blockers": [
      {
        "dimension": "reload.matrix",
        "cell": "action/chromium/action (popup-html-edit-popup-open)",
        "summary": "Reload regression: observed sw=2 nav=1, expected sw=0 nav=1 — extra service-worker restart is user-visible. This is the only code-red blocker; the content-vue failure is infra-flake (advisory) and does not gate."
      }
    ]
  }
}
